[
  {
    "id": "is.w.machine-gun",
    "name": "Machine Gun",
    "shortName": "MG",
    "techBase": "IS",
    "category": "ballistic",
    "heat": 0,
    "damage": 2,
    "ranges": { "short": 1, "medium": 2, "long": 3 },
    "slots": 1,
    "tons": 0.5,
    "ammo": ["is.ammo.machine-gun"],
    "flags": ["directFire"],
    "source": { "ref": "agoac", "note": "AGoAC Weapons and Equipment Table" }
  },
  {
    "id": "is.w.ppc",
    "name": "PPC",
    "shortName": "PPC",
    "techBase": "IS",
    "category": "energy",
    "heat": 10,
    "damage": 10,
    "ranges": { "min": 3, "short": 6, "medium": 12, "long": 18 },
    "slots": 3,
    "tons": 7,
    "flags": ["energy", "ppc", "directFire"],
    "source": { "ref": "agoac", "note": "AGoAC Weapons and Equipment Table" }
  },
  {
    "id": "is.w.srm-6",
    "name": "SRM 6",
    "shortName": "SRM 6",
    "techBase": "IS",
    "category": "missile",
    "heat": 4,
    "damage": 2,
    "cluster": { "rackSize": 6, "groupSize": 1 },
    "ranges": { "short": 3, "medium": 6, "long": 9 },
    "slots": 2,
    "tons": 3,
    "ammo": ["is.ammo.srm-6"],
    "flags": ["cluster", "missile"],
    "linkable": ["artemis"],
    "source": { "ref": "agoac", "note": "AGoAC Weapons and Equipment Table" }
  },
  {
    "id": "is.w.lrm-10",
    "name": "LRM 10",
    "shortName": "LRM 10",
    "techBase": "IS",
    "category": "missile",
    "heat": 4,
    "damage": 1,
    "cluster": { "rackSize": 10, "groupSize": 5 },
    "ranges": { "min": 6, "short": 7, "medium": 14, "long": 21 },
    "slots": 2,
    "tons": 5,
    "ammo": ["is.ammo.lrm-10", "is.ammo.lrm-10-artemis"],
    "flags": ["cluster", "missile", "indirect"],
    "linkable": ["artemis"],
    "source": { "ref": "agoac", "note": "AGoAC Weapons and Equipment Table" }
  },
  {
    "id": "is.w.medium-laser",
    "name": "Medium Laser",
    "shortName": "M Laser",
    "techBase": "IS",
    "category": "energy",
    "heat": 3,
    "damage": 5,
    "ranges": { "short": 3, "medium": 6, "long": 9 },
    "slots": 1,
    "tons": 1,
    "flags": ["energy", "directFire"],
    "source": { "ref": "agoac", "note": "AGoAC Weapons and Equipment Table" }
  },
  {
    "id": "is.w.er-large-laser",
    "name": "ER Large Laser",
    "shortName": "ER LL",
    "techBase": "IS",
    "category": "energy",
    "heat": 12,
    "damage": 8,
    "ranges": { "short": 7, "medium": 14, "long": 19 },
    "slots": 2,
    "tons": 5,
    "flags": ["energy", "directFire"],
    "source": { "ref": "sarna", "note": "TechManual table via Sarna" }
  },
  {
    "id": "is.w.medium-pulse-laser",
    "name": "Medium Pulse Laser",
    "shortName": "M Pulse",
    "techBase": "IS",
    "category": "energy",
    "heat": 4,
    "damage": 6,
    "toHitMod": -2,
    "ranges": { "short": 2, "medium": 4, "long": 6 },
    "slots": 1,
    "tons": 2,
    "flags": ["energy", "pulse", "directFire"],
    "source": { "ref": "sarna", "note": "TechManual table via Sarna" }
  },
  {
    "id": "is.w.small-x-pulse-laser",
    "name": "Small X-Pulse Laser",
    "shortName": "S X-Pulse",
    "techBase": "IS",
    "category": "energy",
    "heat": 3,
    "damage": 3,
    "toHitMod": -2,
    "ranges": { "short": 2, "medium": 4, "long": 5 },
    "slots": 1,
    "tons": 1,
    "flags": ["energy", "pulse", "directFire"],
    "source": { "ref": "sarna", "note": "Tactical Operations table via Sarna; the -2 pulse to-hit bonus also applies to X-pulse lasers (TacOps; MegaMek ISSmallXPulseLaser)" }
  },
  {
    "id": "is.w.snub-nose-ppc",
    "name": "Snub-Nose PPC",
    "shortName": "SN PPC",
    "techBase": "IS",
    "category": "energy",
    "heat": 10,
    "damage": { "short": 10, "medium": 8, "long": 5 },
    "ranges": { "short": 9, "medium": 13, "long": 15 },
    "slots": 2,
    "tons": 6,
    "flags": ["energy", "ppc", "directFire"],
    "source": { "ref": "sarna", "note": "Snub-Nose PPC page: 10/8/5 damage, ranges 1-9 / 10-13 / 14-15" }
  },
  {
    "id": "is.w.mml-5",
    "name": "MML 5",
    "shortName": "MML 5",
    "techBase": "IS",
    "category": "missile",
    "heat": 3,
    "damage": 1,
    "cluster": { "rackSize": 5, "groupSize": 5 },
    "ranges": { "min": 6, "short": 7, "medium": 14, "long": 21 },
    "slots": 3,
    "tons": 3,
    "ammo": ["is.ammo.mml-5-lrm", "is.ammo.mml-5-srm"],
    "flags": ["cluster", "missile", "indirect"],
    "notes": "Default profile is the long-range missile mode; the short-range ammo overrides it.",
    "source": { "ref": "sarna", "note": "MML 5 page: 3 heat, 3 tons, 3 slots, 24 LRM / 20 SRM per ton" }
  },
  {
    "id": "cl.w.heavy-small-laser",
    "name": "Heavy Small Laser",
    "shortName": "H S Laser",
    "techBase": "Clan",
    "category": "energy",
    "heat": 3,
    "damage": 6,
    "toHitMod": 1,
    "ranges": { "short": 1, "medium": 2, "long": 3 },
    "slots": 1,
    "tons": 0.5,
    "flags": ["energy", "heavyLaser", "directFire"],
    "source": { "ref": "sarna", "note": "Heavy Small Laser page (TechManual)" }
  },
  {
    "id": "cl.w.heavy-medium-laser",
    "name": "Heavy Medium Laser",
    "shortName": "H M Laser",
    "techBase": "Clan",
    "category": "energy",
    "heat": 7,
    "damage": 10,
    "toHitMod": 1,
    "ranges": { "short": 3, "medium": 6, "long": 9 },
    "slots": 2,
    "tons": 1,
    "flags": ["energy", "heavyLaser", "directFire"],
    "source": { "ref": "sarna", "note": "Heavy Medium Laser page (TechManual)" }
  },
  {
    "id": "cl.w.heavy-large-laser",
    "name": "Heavy Large Laser",
    "shortName": "H L Laser",
    "techBase": "Clan",
    "category": "energy",
    "heat": 18,
    "damage": 16,
    "toHitMod": 1,
    "ranges": { "short": 5, "medium": 10, "long": 15 },
    "slots": 3,
    "tons": 4,
    "flags": ["energy", "heavyLaser", "directFire"],
    "source": { "ref": "sarna", "note": "Heavy Large Laser page (TechManual)" }
  },
  {
    "id": "is.w.large-laser",
    "name": "Large Laser",
    "shortName": "Large Laser",
    "techBase": "IS",
    "category": "energy",
    "heat": 8,
    "damage": 8,
    "ranges": { "short": 5, "medium": 10, "long": 15 },
    "slots": 2,
    "tons": 5,
    "flags": ["energy", "directFire"],
    "source": {
      "ref": "megamek",
      "note": "ISLaserLarge (2026-10-08): heat 8, damage 8, 5/10/15, 5 t, 2 slots",
      "retrieved": "2026-10-08"
    }
  },
  {
    "id": "is.w.er-medium-laser",
    "name": "ER Medium Laser",
    "shortName": "ER M Laser",
    "techBase": "IS",
    "category": "energy",
    "heat": 5,
    "damage": 5,
    "ranges": { "short": 4, "medium": 8, "long": 12 },
    "slots": 1,
    "tons": 1,
    "flags": ["energy", "directFire"],
    "source": {
      "ref": "megamek",
      "note": "ISERLaserMedium (2026-10-08): heat 5, damage 5, 4/8/12, 1 t, 1 slot",
      "retrieved": "2026-10-08"
    }
  },
  {
    "id": "is.w.heavy-ppc",
    "name": "Heavy PPC",
    "shortName": "Heavy PPC",
    "techBase": "IS",
    "category": "energy",
    "heat": 15,
    "damage": 15,
    "ranges": { "min": 3, "short": 6, "medium": 12, "long": 18 },
    "slots": 4,
    "tons": 10,
    "flags": ["energy", "ppc", "directFire"],
    "linkable": ["capacitor"],
    "source": {
      "ref": "megamek",
      "note": "ISHeavyPPC (2026-10-08): heat 15, damage 15, min 3, 6/12/18, 10 t, 4 slots",
      "retrieved": "2026-10-08"
    }
  },
  {
    "id": "is.w.streak-srm-6",
    "name": "Streak SRM 6",
    "shortName": "Streak SRM 6",
    "techBase": "IS",
    "category": "missile",
    "heat": 4,
    "damage": 2,
    "cluster": { "rackSize": 6, "groupSize": 1 },
    "ranges": { "short": 3, "medium": 6, "long": 9 },
    "slots": 2,
    "tons": 4.5,
    "ammo": ["is.ammo.streak-srm-6"],
    "flags": ["cluster", "streak", "missile"],
    "source": {
      "ref": "megamek",
      "note": "ISStreakSRM6 (2026-10-08): heat 4, 2 per missile, rack 6, 3/6/9, 4.5 t, 2 slots",
      "retrieved": "2026-10-08"
    }
  },
  {
    "id": "is.w.lb-10x",
    "name": "LB 10-X Autocannon",
    "shortName": "LB 10-X",
    "techBase": "IS",
    "category": "ballistic",
    "heat": 2,
    "damage": 10,
    "ranges": { "short": 6, "medium": 12, "long": 18 },
    "slots": 6,
    "tons": 11,
    "ammo": ["is.ammo.lb-10x-slug", "is.ammo.lb-10x-cluster"],
    "flags": ["ac", "lbx", "directFire"],
    "notes": "Slug ammo fires one 10-point hit; cluster ammo fires 10 one-point pellets at -1 to hit.",
    "source": {
      "ref": "megamek",
      "note": "ISLB10XAC (2026-10-08): heat 2, damage 10, 6/12/18, 11 t, 6 slots",
      "retrieved": "2026-10-08"
    }
  },
  {
    "id": "is.w.gauss-rifle",
    "name": "Gauss Rifle",
    "shortName": "Gauss",
    "techBase": "IS",
    "category": "ballistic",
    "heat": 1,
    "damage": 15,
    "ranges": { "min": 2, "short": 7, "medium": 15, "long": 22 },
    "slots": 7,
    "tons": 15,
    "ammo": ["is.ammo.gauss-rifle"],
    "flags": ["gauss", "explodes", "directFire"],
    "source": {
      "ref": "megamek",
      "note": "ISGaussRifle (2026-10-08): heat 1, damage 15, min 2, 7/15/22, 15 t, 7 slots",
      "retrieved": "2026-10-08"
    }
  },
  {
    "id": "cl.w.er-large-laser",
    "name": "Clan ER Large Laser",
    "shortName": "ER LL",
    "techBase": "Clan",
    "category": "energy",
    "heat": 12,
    "damage": 10,
    "ranges": { "short": 8, "medium": 15, "long": 25 },
    "slots": 1,
    "tons": 4,
    "flags": ["energy", "directFire"],
    "source": {
      "ref": "megamek",
      "note": "CLERLaserLarge (2026-10-08): heat 12, damage 10, 8/15/25, 4 t, 1 slot",
      "retrieved": "2026-10-08"
    }
  },
  {
    "id": "cl.w.er-medium-laser",
    "name": "Clan ER Medium Laser",
    "shortName": "ER M Laser",
    "techBase": "Clan",
    "category": "energy",
    "heat": 5,
    "damage": 7,
    "ranges": { "short": 5, "medium": 10, "long": 15 },
    "slots": 1,
    "tons": 1,
    "flags": ["energy", "directFire"],
    "source": {
      "ref": "megamek",
      "note": "CLERLaserMedium (2026-10-08): heat 5, damage 7, 5/10/15, 1 t, 1 slot",
      "retrieved": "2026-10-08"
    }
  },
  {